Description,Commenting,Ogling,Groping
walk along crowd street hold mum hand elder man grope butt turn look h look away whilei yrs old,0,0,1
incid took place eveningi metro two guy start stare,0,1,0
wait bus man came bike offer liftvto young girl,1,0,0
incid happen insid train,0,0,0
wit incid chain brutal snatch elder ladi incid took place dure even,0,0,0
one day walk jorpati saw boy tri take pictur girl n girl didnt know n itel abt repot polish nearbi jorpati,0,0,0
heard indec peopl make indec comment,0,0,0
enter subway dark decid go back sudden man came amp hold hand amp forc go subway also ask number ( lajpat nagar subway ),0,0,0
sexual invit,0,0,0
poor street light,0,0,1
catcal pass comment two ghast thing delhi polic intern airport put friend appal protector law enforc airport make someon uncomfort,1,1,0
happen bus public transport broad daylight way colleg bus crowd enough space two peopl stand back back big bag em particular male stand next seat enough space behind noooooo start rub crotch shoulder subt first veri obvious made discomfort veri appar seem get shift insid seat think ladi besid knew go say word neither peopl behind bus conductor well neither first place frozen grip shock fear think better prepar make shit go someon tri feat never know,0,0,1
one night return hous partyi saw one boy tri touch one young girlbut girl afraid cryingwhen came near boy run sudden,0,0,0
peopl use stare veri inappropri way not tolerableit happen morn night,1,0,1
local colleg guy comment,1,0,0
make weird nois laugh girl,1,0,0
gone get ice cream notic men look drunk turn around start walk away made sexual invit afar,1,0,0
comment stare go back pg dure afternoon hour,1,1,0
friend cross road,1,1,0
incid took place th septemb afternoonin metro rohini east station two boy take pictur group girl sit opposit side,0,0,0
walk road two men bike pass lewd commentsit happen near vishvavidalaya metro station afternoon around pm,1,0,0
return home colleg boy comment whistl,1,0,0
sexual harras dure offic hour,1,1,0
return home workplac even drunk guy intent tri fall upon melat saw polic nearbi got scare went awayit happen near rohini west metro station,0,0,1
harass,1,0,0
catcal comment st bus stand dure morn afternoon,1,0,0
walk home school walk one boy came infront told love didnt knew guy ignor continu follow bodi help,1,0,0
guy misbehav us,1,1,1
teacher beat pupil,0,0,0
culprit stare group girl stare comment veri cheap way incid happen dure afternoon,1,1,0
shock whi incid report pink cityev teas veri common happen girl almost everi daywel let share incid friendw studi prestigi girl colleg jaipur stay pay guest cscheme jaipurtwo friend went market get someth sudden car came think boy caron tri drag friend car grope wrong placeluckili friend save shout dreadfulsh still cannt forget incidentthi not case kind incid keep happen,1,0,1
report made dadar street market exact locat bigg sale maitreen shop particip feel safe dadar street market due mani instanc stalk,0,0,0
comment take pictur dure even,1,0,0
saw man forc take girl not know help one around help either happen night thursday market,0,0,1
boy comment shout,1,0,0
touch breast back,0,0,1
boy touch one girl public bus,0,0,1
step mother chase girl hous night,0,0,0
head work notic someon follow decid chang rout shoout say prostitut didnt golden vagina,1,0,0
ogling/faci express gurgaon sohna,0,1,0
harass,0,1,0
biker,1,0,0
enjoy ice cream famili good time sudden felt someon grab hip first felt happen accident later go tortur twice scare death felt helpless scoundrel tall long hair dark complexion seem like drug addict recognis face still haunt,0,0,1
night chain phone snatch,0,0,0
group boy stand star us start move one comment friend,1,1,0
sit desk work manag come ask updat stare onli chest femalesalso make indec remark newli join member regard sare,1,1,0
men see,1,0,0
impregn school boy use call everi time harass,1,0,0
guy stood front door obstruct way caus harass,0,0,0
one tall boy almost regular teas come gate catcal sing song indec manner,1,0,0
neighbour forc drug girl hous lock sexual assault,0,0,0
ogl touch general compart dombivli train,0,1,1
group peopl teas girl mouth bad word,1,1,0
friend mine sexual harass bus though seat bus vacant old guy sat near keep touch intent want creat scene get bus though stop,1,1,1
man invit sexual pleasureit happen,0,0,0
way school old man come toward grope breast hurt lot veri scare ran school told friend laugh made fun kept shut ever sinc,0,0,1
follow drunk man,0,1,1
man came close wait friend road said would give big money went sex,0,0,0
indec environ area lot drunker,0,0,0
saw boy go bike comment girlit happen even,1,0,0
peopl comment take pictur daili busi,1,1,0
boy comment bad word,1,0,0
mumbai central station,0,0,0
walk around india gate guy constant click pictur person went delet pictur happen dure afternoon,0,0,0
old person touch friend bus even lot rush,1,0,1
walk man came start tell nowaday stop talk told go hous,0,0,0
molest murga chowk men snatch dupatta start touch inappropri broad daylight horrifi not safe even dure day,0,0,1
go buy kerosen man stop cover mouth tri touch breast,0,0,1
breast grope,0,0,1
person delhi metro take pictur girl cell phone,0,0,0
chase bike,0,0,1
ladi hostel areamani guy stand commentsand show intern part cross areaplz help make area free idiot touch walk bikeso pathet,0,0,1
walk even guy pass comment quot oye hoy kya lag rhi haiquot,1,0,0
dure afternoon travel metro lot touch general compart,0,0,1
stare touch,0,0,1
incid took place bus two guy click pictur happen dure afternoon,0,0,0
guy follow pass comment,1,0,0
happen night,1,0,0
stare,0,1,0
follow comment man walk street,1,0,0
noth happen yet aunt teas group boy go colleg,1,0,0
whistl pass valgur comment,1,0,0
show vulgal pictur fb mgs one relat,0,0,0
verbal sexual harass sexual invit touch etc,0,0,1
touch inappropri metro dure afternoon,0,0,1
chain snatch man near yrs old,0,0,0
dure colleg one eng teacher use touch hand back stare veri bad dont know got number stare call everydaydu switch phone sever month,0,0,1
boy snatch chain woman,0,0,0
come school met boy way call friend tell irrelev thing,0,0,0
man show privat place scooter act though noth happen,0,0,0
man touch bodi part play holi,1,0,1
men catcal comment im either way school way back home,1,0,0
conductor said veri bad comment insid bus,1,0,0
onc go back home guy star kept comment ( busesdhaula kuan ),1,0,0
buddh bazaar shop man whistl walk side give wrong express,0,1,0
indec behaviour,0,0,0
public transport touch grope happen time stupid person present everywher delhi,0,0,1
group guy bike pass comment girlsit happen even,1,0,0
friend mine rape plan group boy date onc date boyfriendon way never knew plan boy came took field rape went unconsci,0,0,0
incid happen foota road vika nagar phase men molest friend street near hous,0,0,1
tap boy came pour water found year old girl wait fetch water grab hand drag away,0,0,1
car park particular scari public space dark dusk not pleasant would avoid,0,0,0
teacher use assault told mother ask not go tuition,0,0,0
cheap comment whistl board metro morn,1,1,0
tuition teacher use touch chest use talk sex show pornograph video,1,0,1
ogl facial express comment,1,1,0
comment regular basi near club gym,1,1,0
guy wistl friend way,1,0,0
walk aunt place saw group boy call come refus one walk touch breast want react start insult,0,0,1
metro pass cheap comment follow tri take picturesit happen rajiv chowk metro station afternoon,1,0,0
go home time group boy bull take pictur girl boy girl time girl went home,0,1,0
physic touch privat part even time crowd street newroad,1,0,1
man felt friend hand genit,0,0,1
public vehicl one boy touch bodi,0,0,1
call us local name like chinki,1,0,0
yester even wife com vastrapur nandan baugh way one guy motorcycl catcal comment pmsinc strech bopal applewood veri isolatedrequest author tri patrol road mani ladi go work come home late till,1,0,0
boy alway harrass use return home colleg,1,1,0
go home uncl pass hit front move ahead,0,0,1
girl go schoolit sunday boy comment passingthat veri depress went home rather go school,1,0,0
mate two men way home school told feel like sex,1,0,0
stake indec messag friend north east,1,0,0
bus stop would board bus three car would pass one sometim even follow school,0,0,0
lol happen everyday actual use,1,1,1
like eveteas noth veri great extent two guy tri follow way back home behav indec,1,1,0
pinch return colleg bus c onli becaus two stop becaus told not exact word english could slap hand full bag back also c also pretti crowd even enough space anyth wish stop,0,0,0
come class saw group boy teas girl,1,0,0
group girl us travel public vehicl conductor vehicl teas us,1,0,0
walk road bike came behind pull hand drive full road,0,0,1
touch dtc bus gagan vihar afternoon th august,0,0,1
onc grant road station intent grope elbow man kept oggl till took local train,0,1,1
comment boy take pictur,1,0,0
guy whistlig comment,1,0,0
comment ogl catcal local market area quotwin beer shopsquot specif back area netaji subhash palac complex bylan etc,1,1,0
street harassmenta month ago come back buea bus station guy sudden snacth travel box ask return box start insult not stop gave want insult also,0,1,0
night wit time,1,0,0
colleg friend comment short dress canteen said instig bad thing,1,0,0
three guy comment girl dress style,1,0,0
harass afternoon,1,0,0
two girl ogl chandivali junction,0,1,0
harass,0,0,0
guy whistl,1,1,0
roadsid boy hoot comment,1,1,0
saom women follow men night,0,0,0
passerbi pass leud commentseven time,1,0,0
everi day bridg crowd not walk proper offic time morn daili men take advantag touch women not singl polic personnel look happen continu happen sometim light work bridg difficult walk dark bridg,0,0,1
harass boy comment take pictur whistl,1,0,0
place sector vashi navi mumbai pm got sector bus stop best bus start walk toward home footpath shadi without street light decid walk along road walk someon loud scream footpath quota idhar idhar dekhquot involuntarili turn direct see guy ( labour ) masturb smile shock wait around turn back walk away brisk spot light crowd kept follow sometim found head direct mani peopl turn around went wayi shaken reach home felt fear reflect feel punch good howev run away could think moment,1,0,0
friend sudden guy start whistl went hurriedlyit happen even,0,0,0
girl call boy wink,0,0,0
way town realis neighbour follow kibera place work,0,0,0
stalk comment group men,1,0,0
walk toward hous guy start comment,1,0,0
stare man wait ola cab outsid gate metro station stare linger made thorough uncomfort,0,1,0
peopl follow whistl ask number,1,0,0
travel bus person stand behind fulli touch bodi part point said bus crowd whi happen could feel not becaus rush,0,0,1
comment rangpuri even,1,0,0
woman harass mutengen thiev ( dealer ) money taken,0,1,0
church amn start call sweeti babi great fear becaus approach,1,0,0
public space saw man offens action,0,0,0
day walk friend one boy street shout say size,1,0,0
om sai beach hut not safe femal solo travel owner gaurav bhagat drunk told staff watch see sleep friend ( stay seper room ) call check entir staff give inform activ whereabout bother not hit eventu staff watch report doe not make feel safe fact becaus mani doubt overal safeti place hut bathroom hole wall someon could see insid overlook doubt someon watch slept chang cloth thing requir privaci not recommend place anyon know told,1,1,0
three boy normal sit spot call quotbiasharaquot wait pass comment dress one day whistl ignoredthey insult,1,0,0
poor light walk chan turn war catcal well,0,0,0
street light,0,0,0
incid took place septemb dure morn around ama girl drive twowheelertwo boy hit activa scooti soft touch back swept cloth,0,1,1
travel bus delhi merut highway ( nh ) site somewher middl bus rowposit second column seater side girl age around site next gap walk someth similar positionsa guy age walk passag stood us fill passag gaph face toward girl back portion toward mehi lower part face level girl approx level becaus hi stand girl site push toward girl use bus movement mani timesth girl site face eye close terrifiedi left seat could give place person stand indirect help girl walk littl distanc stood even tough seat vacant man not took seat realli shame wish could done help girl,0,0,1
touched/grop,0,0,1
travel bus teen age boy whistl well comment nonsens,1,0,0
one day travel bus girl sit near behind boy stand pass cheap comment girl know ignor becaus need travel daili,1,0,0
even friend circl group guy stunt comment girl present circl,1,1,0
metro dure even hour guy tri touch,0,0,1
abus ask die,0,0,0
mother sick money buy medicin decid start wash cloth get money man ask wash cloth wash man came touch buttock,0,0,1
around pm bus one guy sudden grab phone ran away,0,0,0
man touch girl bus,0,0,1
peopl includ sister reach destin decid take yellow line metro civil line boy sit see sister start whist sing cheap song,0,1,0
light,0,0,0
report friend mother wit rowdi biker make attempt snatch woman jewelri take routin walk woman rais alarm men came rescu tri chase biker sight right woman traumat resid decad nowher expect report matter polic,0,0,0
incid took place three month ago dure night rooster puba man late indian cloth sat corner ogl girl thereh pass lewd look comment minor,0,1,1
continu comment whistl outsid univers stadium north campus happen afternoon around pm,1,0,0
misbehav,1,0,0
bus group boy start comment look pretti ignor start teas ask number,1,0,0
board matatu makina olymp yoiung ladi dress mini skirt tout togeth gys hang door start talk describ well made,1,0,0
catcal indec exposur,0,0,0
dure night around pm guy ask go place,0,0,0
fate even went visit friend mine began discuss togeth began go anoth level discuss start tell alway want friend himi began ask meant repli want girl friend immedi want sex moment refus insist thank god friend came hous save,0,1,0
man follow wednesday market go tri mislead doe not figur home address spot market,0,0,0
passerbi touch us car even follow us,1,0,1
peopl scare chain snatch wit biker enter residenti area snatch chain purs wom en incid eve taes also increas day,1,0,0
eve teas veri common colleg comment teas etc,1,1,0
follow boy teas follow even main street,1,0,0
girl wit somebodi click pictur although not sure,0,0,0
go church sunday met drunkard old man call ignor start abus say quotmalaya wewequot mean prostitut,1,0,0
girl brutal beaten boy unknown reason one came forward help herit happen novemb even,0,0,0
eve teas use bad word,1,0,0
call terrac greed chocol follow bus stop day,0,0,0
take advantag crowd guy tri touch dure even hour,0,0,1
walk back home sudden group boy group around tri talkit happen even,1,1,0
harass even gk,1,1,0
misbehav,0,0,1
found site recent guy kept walk behind quit time time look back would somehow disappear crowd step later felt someth jab hip spun around practic inch get good look face due shaggi lank hair reach chin quick back befor could rais alarm surpris part bus stand jam pack mani peopl must notic none bother interfer request pleas bewar filthi lout,0,0,1
physic touch man insid public bus,0,0,1
art craft group start send nude pictur girl start line prostitut,1,1,1
man tri sexual assault,0,0,1
market area veri crowd not stop go men boy pass us touch us make excus dont enough place go also comment us,1,0,1
harass bus,0,0,0
men stare start comment sort eve teas,1,1,0
catcal comment touch old delhi,1,0,1
whenev pass area shopkeep comment sometim give sexual invit,1,0,0
biker tri touch breast push fell bike hurt start abus call polic,1,0,1
teacher beat student,0,0,0
one festiv newar saw live harass girl group boy touch part girl,0,0,1
boy lie took friend slept day mum complain threw hous night,0,0,0
boy comment tri grope crowd place,1,0,0
best friend sexual harass neighbor six year old still live next inform anyon,0,1,1
way home school men sit idl whistl refus respond start abus,0,0,0
saw scene mall afternoona girl stand outsid mcdtwo boy came start comment repli start call actress name start whistl,1,1,0
friend molest neighbour inform parent immedi taken task,0,0,1
come back flat job greater noida two boy follow auto say quothow much charg one nightquot,0,0,0
realli bad,1,0,0
boy grope stare like hell,0,0,1
men gang stare day even pass comment make difficult us use block e main road lead home,1,1,0
whenev friend pass boy sit around start comment sing song etc,1,0,0
left friend place went meet friend ladi welcom veri nice continu chat put ponograph video play reali made feel uncomfort sinc friend friend,0,0,0
two guy follow friend metro befor board got outthey stare us throughout,0,0,0
stalk man market street live tri mislead,0,0,0
father brother gopi krishna movi hall ticket counter bit crowdi one guy touch girl girl immedi repli shout later guy felt shame backoff,1,0,1
comment ogl catcal someth usual happen metro,1,1,0
friend rape tuition teacher,1,0,1
local chawl men call name caus seper husband,1,0,0
sexual harass one morn go school friend guy appraoch us start ask name friendunfortun friend spat facewhen come back school guy attack us friend took us dark environ gave us beat ourliv collaps onli woke realis ourselv hospit,0,0,0
survey carri safec ( red dot foundat ) along safeti audit street market mumbai,1,1,1
young girl harass father hous without parent know later discov night man tri kiss gir know whi girl not report parent think inlov man,0,0,0
take advantag crowd dure rush hour,0,0,1
exboyfriend call blackmail girl,0,1,1
case classmat read school one sunday morn unknown man appear widow class wasth man stood long time watch girl read start ask girl question enter class cutlass ask girl undressth girl also play trick escap wound hand man,0,0,0
famili near amus park class th know much sexual harass one person walk past touch inappropri,0,0,1
not feel safe,0,0,0
girl grope peni,0,1,1
articl written last year situat took place bare enter th grade leav high school flashback day time bodi empti canva boy splatter paint tell stori th grader gurgaonquotth stranger lip graze upon end cheek bruis arm pin dusti grey ground room kept alert eye outsid face unknown men uniform smirk stranger slid snakelik finger bodi struggl undo button could feel eye turn red bit hard shoulder small voic said leav dont like felt empti liquor bottl leg hand flesh jerk push asid head buzz alcohol panic manag stand look around realli want straighten press frail bodi upon nake wall not push asid ran toward open hall men age stood rail oblivi act cheek burn forc kiss shame hold shoe hand scurri staircas search known face look run reach cold lobbi offic stare entranc strang glare anxious face shove stiff self close elev seek unfasten pair short settl forc slither finger waist whisper go finger like asshol whimper hop away felt back cloth seek phone wasnt rush panic exhaust fled offic hallway rummag around build explor everi step took earlier search prize possess not eye burn even tear blind vision settl raw cheek behind rush downstair head busi road broad daylight scuttl barefoot search friend late gone stranger behind grab shirt strong hand rip cloth bare back becam expos blink light stare million nameless men cri help nobodi care enough hear ran faster without possess phone money bag whi gaze crowd nearbi came rest staircas tear ran face unknown figur settl around head knew whisper strive punch familiar number phonedo rememb moment child gone astray parent cram market place moment devoid ani thought onli thought worth get back safe rememb worri face moment magnitud shook back forth glanc abund face unabl see delic featur muddl concern men women walk past put forward help hand not trust matter minut agon face rush past stood ran toward open arm world stood still held took accustom smell cologn felt homesick wave crash wall head im scare hes go find said enough know took grey shirt bag walk eyesight alien peopl wear murmur prop hand shoulder pull close rescu friend clutch stranger friend depart curs locat ride end hous held face low voic inaud friend next room ask favour dont anyth stupid said anxious read mind state friend beyond categori wast follow given duti pick marbl floor led toward societi gate wave brief goodby timid walk away mesometim dont need word explain feel sometim know like knew enfold scent shirt felt possibl petrifi episod face made easier breath sometim dont need date love somebodi month feel comfort dont need kiss even around time nervous presenc linger around moment enough demonstr establish brief connect safe even minut sorri glad said word phone formal stand park watch walk toward gate could feel happen may not episod import chang everythingim sorri danc end arm swear world stood imposs stillquoti attempt suicid hour later save live strong tell stori,0,0,0
man regular bus rout got stop touch wrong place felt veri bad,0,0,1
pinch breast water park mehsana gujarat,0,0,1
four boy whistl comment girlsit happen night,1,0,0
walk street guy stand lean gate home whistl call whole time cross homei take road daili except sunday go music classesthi went month final quit music classesi,0,0,0
meet meet went asid talk phone certain man came start urin fenc anoy,0,0,0
age yearstyp harassmentstalk leh market ( day time ) caltcal choglamsar near choglamsar bridg ( even ),0,0,0
father neighbourhood engag sexual activ daughter forc,0,0,0
uncl beat wife street outsid hous one help ladi later went insid assault lock,0,0,0
night guy comment cloth,1,0,0
boy stare catcal go home school,0,0,0
sever girl rescu video den mashimoni villag exploit pornograph film video hall,0,0,0
travel bus man stand behind tri touch,1,1,1
poor street light,0,0,0
amaz rude face given buy guy dure afternoon hour,0,1,0
friend tri kiss forcibl park,0,0,1
report regard survey conduct sexual harass differ form particular area,1,0,1
somebodi tire touch sensit part,1,1,0
boy area make indec pose follow girl scooti speed bike make sound,0,0,0
stick touch bus crowdwhistl walk home,1,0,1
attack tri grab gold chain push,0,0,0
group worker click pictur run park multipl pictur taken call local secur guard snatch phone delet pictur,0,0,0
man tri touch woman,0,0,1
general coach metro ( kashmer gate ) saw group boy pass comment girlit happen even around,1,1,1
around pm got vishwavidyalaya metro station get back hostel saw guy follow minut pull back ask friend touch inappropri shout ran without look back hostel,0,0,1
middl age man comment dress also tri touch way home school,1,0,1
one day travel metro friend afternoon one two person came start comment,1,0,1
walk mall friend middl age man ride bike watch us make inappropri face pass comment us annoy not onli youngster grownup also respect women,1,1,0
girl touch aimless boy school never report teacher,0,0,1
incid took place eveningoutsid mall boy pass lewd comment girl stand alon,1,0,0
teacher hit student chick,0,0,0
drunk men harass,1,0,0
one boy next home alway stare,0,1,0
sexual harass friend attend even schoolon way home took bike park reach hous bike man carri rape plantationit veri touch becaus unabl get found morn taken hospit,0,0,0
saw two boy bike come opposit direct snatch golden chain middl age woman cri loud get back vanish second place,0,0,0
harass metro feeder,0,0,1
incid took place th septemb around pmi go class got car guy push mehe expos privat partsi bash along polic,0,0,0
woman thrown hous babi without food two week depend passersbi babi feed harass take advantag hoodlumsh child expos danger,1,0,0
survey carri safec ( red dot foundat ) along safec audit street market mumbai,0,1,0
one person snatch chain,0,0,0
chain snatch due por street light,0,0,0
sexual abus friendwhen come back villag farm man caught abus sexual,0,0,0
th dec pass group boy call ignor themth persist follow ignor themal sudden start call name,0,0,1
happen minut befor street two guy came bike snatch ladi chain ran away shock happen bright noon public around,0,0,0
one friend molest dure new year eve,0,0,1
stay hostel near incom tax often guy pass lee comment stare girl way make uncomfort mani time,1,1,0
cab driver kept brush leg kept ask number,0,0,1
play hide seek game hide neighbour hous peep bed sex anoth kid report nobodi believ said liar,0,0,0
sing,1,0,0
harass,0,1,1
acid attack,0,0,0
use face almost everyday dure internship period,1,1,0
pass street guy whistl,0,0,0
incid took place th septemb around amit happen park near kanhaiya nagar metro station mother teas unknown person,0,0,0
class return tuition class boy pass lewd comment,1,0,0
uncl harass alon,0,0,1
return home market boy stand near pass vulgar comment,1,0,0
incid happen wednesday market man constant stare follow around told vendor nearbi confront man went away happen even,0,1,0
post sunset get veri dark scar men loiter around feel unsaf,0,0,0
one day friend mine move along roadit th januari stroll along road man approach stop listen man told not interestedth man got annoy pull near push bodi rescu heraft rape girl ran away,0,0,0
number boy wistl comment walk street bhaktpur,1,0,0
vehicl go town kariobangi man seat next start touch breast felt indec alight bus,0,0,1
come back jamia millia wait auto stand group colleg boy pass filthi comment ignor min boy approach said veri bad word made feel like cri live alon jamia hostel not safe ani gir miss parent live bihar studi jamiai sacr sometim cri class tooit veri difficult explain feel even univ student pass filthi commentsit ani disciplin r either classmat see class colleg chang total illitarar,1,1,0
old man came near touch privat bodi part insid tempoo,0,0,1
happen even,1,1,0
