Description,Commenting,Ogling,Groping
block way make suggest beckonng gestur put head walk around beaus way larger stronger cross road stop debat safe distanc report becaus uniform not exoect threat doubli threaten cant think solut onli said fail,0,0,0
realli bad,1,0,1
harass afternoon,0,1,0
grope,0,0,1
comment catcal whistl,1,0,0
old man tri touch friend final rebuk person happen dure morn hour,0,0,1
stare like never seen girl befor,0,0,0
man touch inappropri bus,0,0,1
touch grope public buse,0,0,1
guy persist chat refus advanceson day way back school met guy mile nkwen bamendah stop said need talk mei realli tire need go back homeh held forc arm rufus let goi pleas avail let goso final saw two male friend eat call themwhen guy grab freed left two male friend,0,0,1
dure even indec touch grope,0,0,1
sit window seat bus boy thrown balloon,0,0,0
stand sister bus stop wait bus two guy came car actual invit us car lewd comment,1,0,0
return home sister home face gang boy start whistl comment stare took way home rush,1,0,0
go buy veget near main road petrol pump cross area truck park men drunk misbehav tri grope scream peopl came rescu,0,0,1
railway station year ago veri crowd uncl touch behind,0,0,1
mela mount mari man approach behind touch wrong said becaus crowd happen mistak lie,0,0,1
wait bus way colleg man came close touch breast start say breast beauti,0,0,1
walk railway stationth man brush lot space walk,0,0,1
boy follow way colleg,0,0,0
incid took place eveningther girl walk man sudden came construct barrier metrohh tri hold sinc red light mani car not abl,0,0,0
walk saw someon stalk,0,0,0
late friend home home way boy threw pebbl teas,1,0,0
street light,0,1,0
incid took place st novemb around eveningtwo men stand post whistl pass comment,1,0,0
friend travel metro stranger held hand,0,0,1
teas boy,0,0,1
guy comment make inappropri express insid metro,1,0,0
comment catcal whistl ogl facial express,1,1,0
two three guy white colord activa follow friend rickshaw tri snatch phn friend tri save nd phn run away ws realli danger might weapon pleas look matter asap,0,0,0
ladi ask chang matatu tout refus give back money arguedthat ladi didnt knw work shouldnot start teach jobit took intervent passeng woman get back money,0,0,0
dure school day mental tortur threaten,0,0,1
young boy took pictur walk,0,0,0
guy whistl call get physic involv,0,0,0
morn men beat year old boy veri bad cycl get touch bike,0,0,0
walk cafe along friend guy start sing tacki bollywood song point toward us,1,0,0
harass,0,1,1
old man tri touch young girl,0,0,1
head toward colleg marri man sat touch sensit organ bodi initi ignor action repeat ask stop,1,0,1
bo friend alway stalk pass comment quotbhabhiquot realli veri annoy,1,0,0
teacher beat student,0,0,0
friend wait bus stop one man stand know man give discomfort facial express could not toler friend anyth left,0,1,0
harass,1,0,0
liter less block hous ( pm ) walk slight slower normal attract coupl look young guy came behind ( didnt see come ) slapped/grab butt sprint away opposit direct jar especi cuz pm close hous one blink eye ( main lower incom men close time ) shiver,0,1,1
friend stalk men day stretch told us scare confront keep ignor told react befor thing go hand,0,0,0
comment even,1,0,0
grope inappropri comment,1,0,1
random sardar metro tri molest,0,0,1
two boy bike snatch chain girl uttam nagar metro stationthi incid took place st septemb,0,0,0
walk home truck pass slowli side guy insid truck made weird face whistl comment quotaunt get wayquot,1,1,0
take pictur girl pass abus comment,1,0,0
two young ladi cross road toi market way toward kibra law court men comment said quotthes one need penisquot,1,0,0
comment stare area even,1,1,0
onc walk lone street guy make filthi gestur invit sexual happen dure night,1,0,0
even,1,0,0
boy pass comment chinki look,1,1,0
dure morn metro man constant look ogl facial express,0,1,0
creepi peopl tri follow dark,0,0,0
catcal comment bad facial express take pictur indec exposur sexual invit,1,1,1
dure even pictur taken confront guy delet,0,0,0
polic offic comment,1,0,0
ladi cycl rickshaw ask boy direct snatch chain,0,0,0
come back visit friend place near dana paani beech boy start whistl sing song made high uncomfort,1,1,0
incid happen taj land end coffe shop meet founder save life foundat even midst serious discuss man came us first wish colleagu turn said someth effect guy fking real goodbefor could react disappear call waiter ask thing could happen star hotel assum quotsafequot space claim drunk hang around whilei convers hotel question find procedur preemptiv measur patron drunk well find ident guybut rais question need alert time street harass seem move indoor could serious person decid physic assault access cutleri,1,0,0
guy dtc bus intent touch,0,0,1
grope bandra station old man seem intent,0,0,1
chain snatch incid coupl guy bike snatch necklac woman stand across street,0,0,0
visit place see relat night unsaf,0,0,0
aboy forc kiss peni refus ran,0,0,0
onc tri get rick ghansoli gaon becom difficult around pm sinc gaon peopl would roam especi men make ani woan uncomfort,0,1,0
scooti ( alon ) two boy motorbik grope start laugh scream drove fast could shock could happen aligarh could not note bike number,0,0,1
go toi market came across man hit shoulder rais eyebrow wink piss,0,1,0
one senior came us second day colleg group start abus us without ani reason,1,0,0
girl harrass group man not abl say anyth,1,1,0
guy misbehav,1,1,0
stalk drive alongsid ask person info like name home etc,1,0,0
two biker snatch chain ladi near jnakpuri metro stationit happen morn,0,0,0
felt unnecessari touch around privat organ sever time public vehicl area feel uneasi public vehicl,1,0,1
one night sleep got phone call around pm got frighten receiv call think might sort emerg urgent call receiv call came know bluff call one man talk want know hung phe continu call n disturb whole night,0,0,0
face ani friend due work veri bad experi,0,0,0
teacher bad intens student touch us sit bench,0,0,1
two men park lot kept stare go toward car kept ogl made realli uncomfort glare back giggl,0,1,0
sexual invit hoot,0,0,0
onc girl relat uncl night girl uncl touch girl asleep small take action meantim mother enter room saw activ done law care societi fill complain way save daughter,0,0,1
teas go school come back school local boy bhatbhateni area,1,0,0
name conduct survey guy touch girl indec manner ( north campus outsid metro station ),0,0,1
comment khayala new delhi,1,0,0
girl boyfriend continu cri guy hurt hand badlyit happen even,0,0,1
ogl travel bus,0,1,0
mani incid experienc one want write happen year ago girl year rape neighbor parent took hospit take treatment,1,1,0
one male daili travel use take advantag crowd bridg use touch press ladi,1,0,1
follow someon,0,0,0
phone got stolen delhi metro dure night,0,0,0
ogl,0,1,0
born brought cochin experienc veri mani differ sort experi rang comment indec exposur touch privat buse run citi last row ladi seat ladi doe not tend sit becaus reason old man age around use follow show indec bodi part everi day school place till home area mom use live alon scare even report polic,1,1,1
afternoon girl year pase call boy start touch,0,0,1
stare comment,1,0,0
touch man way back home tuition incid happen th grade minut hous incid took place random smile stop touch time stood still,0,0,1
happen morn time dure walk girl touch inappropri person ran away befor girl reaction,0,0,1
verbal abus indec languag behaviour teenag boy,1,0,0
comment,1,0,0
waterfal near karjat drunk peopl pass comment stare friend,1,1,0
one young man follow come dhungedhara bottl bag catch hand pool toward himi coundnt anyth not big enough fight ppl around help final shout left,0,0,1
colleagu also senior work kept forc take lift despit refus kept call text follow work stop confront told not interest complain manag fine,0,1,0
misbehav,0,0,1
read news papper read news wear veri scream news one girl rape peoplewhen read news n fill veri sream,0,0,0
feel elpless,1,0,0
walk cousin road mani men stare small sister around ignor walk along act like never happen,0,1,0
man start teas bus way school,1,0,0
touching/grop sexual invit pictur taken even afternoon,0,0,1
girl boy talk among themselv say chines though indian,1,0,0
misbehav,0,0,0
boy shout friend train platform inappropri manner,0,0,0
friend mine group ill manner guy comment obscen bodi,1,0,0
sufferd one month one wrong caller bad take either follow ask whu u saya dis compani number u trace u pls help meiwa sufferd person talksc campkurnoolregardskanuradha,1,0,0
way back home met boy whistl ignor start insult,1,0,0
employe taj krishna husband stay week wear loos fulli cover cloth spite,1,1,0
public vehicl touch bodi part boy,0,0,1
one day friend goin home school alon boy stand street comment bad realli veri ridicul,1,0,0
harass guy whistl pass loos comment,1,0,0
apart stay friend morn guy sit next friend shock moment start touch scream sinc scare sleep alon person escap knew structur apart well,0,0,1
boy year old pass filthi comment friend,1,0,0
irrit behavior even,0,1,1
walk friend us teas,1,0,0
take pictur girl pass area,0,0,0
travel bus alon boy sit besid tri touch feel insecur scare,0,0,1
catcal comment even,1,0,0
guy walk behind singl sexual explicit song,0,0,0
onc walk streetwher saw group boy chit chat laugh cross start call name sing gain attent,0,0,0
famili function home harass want intimid,0,0,1
friend stalk men car,0,0,0
studi spohia colleg suppos enter colleg pedder road gate didnt id card henc go pedder road main gate walk man bike ( wear helmet didnt see face ) pass friend ( toward side ) said like bodi wear veri decent long indian kurti comment realli felt disgustedi couldnt react shock incid happen first time,1,0,0
alon home later father came offic forc touch breast cri lot,0,0,1
happen month ago go fetch water eveninga boy even know call say type nonsens doe not concern,0,0,0
guy make indec facial expressin,0,1,0
group girl pass school certain boy start call girl never look back nad boy start abus shapeless,1,0,0
return colleg group boy teas lot say bad word,1,1,0
month ago group girl wear go fo hike shivpuri three galsbut jugl group boy wear thre n tri whisl n sing song us ran away,0,0,0
ladi faculti art ask date lectur befor could pass coursethat ladi told,0,0,0
whistel catcal grope becom frequent thing proper light veri unsaf women,0,1,1
onc girl almost rape birth day partydu intervent girl rescu,0,0,0
even guy pass comment,1,0,0
auto driver even pedestrian stand occupi whole skywalk intent grope girl women tri pass strict action must taken control imbecil insol freak think behav pleas women forget woman gave birth,1,0,1
sit domino wait friend group boy sit tabl next start behav inappropri stare comment,1,1,0
girl neighborhood rape park near kali basti lock parent not know happen,0,0,0
touch ogl etc,0,1,1
onc stand bus stop anoth girl stand behind sudden maniac man came tri kiss whatev dont know cut girl lip,0,0,1
catcal,0,0,0
two boy stand center market stare friend,0,1,0
go back tution around pm auto driver look pass comment misbehav happen near virat cinema,1,1,0
travel bus guy grope indec constant comment,0,1,1
incid sexual assault,0,0,1
comment munirka,1,0,0
incid happen night june young boy around year old take pictur girl back,0,0,0
street light comment,1,1,0
come colleg boy stand street stare pass comment laugh,1,1,0
walk look butock say quottumetosha mbogaquot,1,1,0
man kept stare uttam nagar east metro station,0,1,0
maintain hous person abus us expos take cloth hit door hammer replac door new one drunken got anger happen ask go hospit treatment ill person need take treatment,0,0,0
man use repeat call tri make convers ran away stop,1,0,0
man stare veri bad bus tri close,1,0,1
return home pm public place group men catcal peopl around ignor situat ignor name move,0,0,0
ill treat,0,1,0
guy flash near park,0,0,0
saw taxi driver not drive stare ladi pass stare top bottom liter stare till time visiblesukh sagar bus stop,1,1,0
way uncl home saturday man follow young girl whistl,0,0,0
group boy whistl go toward home,0,0,0
saw group boy whistgl take pictur girl go school,0,0,0
one colleg friend wait bus came old man invit sex ignor went place mani peopl,0,0,0
shop tnagar road chennaii notic men call name disturb,0,0,0
chain snatch,0,0,0
realli bad,0,0,1
man tri rub elbow breast,0,1,1
follow group men car way home,0,1,0
train gent compart amp guy tri touch inapproprait,0,1,0
lane communiti grope,0,0,1
take pictur continu comment dure afternoon hour,1,0,0
auto walla wass make inappropri express,0,1,0
boy follow friend gina way one boy said love muchh keep follow gina,0,0,0
catcal,1,1,0
comment happen night,1,0,0
saw guy take pictur girl,0,0,0
wit incid guy tri touch girl travel bus,0,0,1
certain woman call offer lift whe enter car drove unknown place,0,0,0
shivaratri street full crowdand crowd one guy pull touch back portion friend bodyat time pinch home went away,0,0,1
follow metro station,0,0,0
realli bad,1,0,0
general touch grope stare metro station comment catcal street,1,0,0
number guy call odd hour amp send lewd messagesi bangalor yes guy calcutta send messag bengali call odd time send lewd sms,0,0,0
survey carri safec ( red dot foundat ) along safec audit street market mumbai,1,1,0
north east report,1,1,0
grope man also forc upon woman,0,0,1
touch stranger birla planetariuma nake man expos friend along ajc bose road,0,0,1
men follow girl skywalk bandra station,0,0,0
sexual invit,1,1,0
wait metro afternoon two guy take pictur say anyth unabl speak hindi,0,0,0
ek baar main famili ke sath mahalaxmi ja rahi thi ek admin mere brest pe hath mara tab main bahut dar gayi thi aur gharvalonko bhi nahi bata payi,0,0,1
peeopl touch also comment,1,0,1
girl rape mile dibanda got pregnantaft realis man involv cult,0,1,0
guy use comment sister way tuition,1,0,0
ill treat,0,0,1
boy stare,1,1,0
boy usual roam around place pass bad comment girl whistl etc,1,1,0
dtc bus cpchandni chowk experienc indec exposur touch prod,1,1,1
indesc exposur total nake man ladi compart strip insid compart,0,1,0
boy stare friend,0,0,0
two guy motor cycl snatch chain ladi get rickshaw,0,0,0
stand around pm bus stand guy stand comment ignor,1,1,1
guy continu comment girl metro general coach dure afternoon hour,1,0,0
men comment friend,1,0,0
boy chew khat whistl way home school,0,0,0
use cale name left school home name like beauti,1,0,0
girl pass buy near group men men start call girl never paid attent men told cheap girl,1,0,0
neighbor abus child three month scare tell anybodi,0,0,1
market friend boy stare us start comment etc,1,0,0
notic group boy alway sit along railway line wait pass call name whistl,1,0,0
dure afternoon yamuna bank station lot touch,0,0,1
group boy use teas friend pass differ comment,1,0,0
peopl road haress colleg girl,0,0,1
child abus,0,0,1
wa travel colleg bus one person com near touch bodi part,0,0,1
school teacher call offic offic start touch breast forc kiss,0,0,1
septemb incid bad comment boy happen maharani bagh,1,1,0
go colleg one touch hand,0,0,1
one friend sexual molest cousin,0,0,1
father girl die mum got marri anoth man step father not like girl forc go stay aunt aunt return gave girl work anoth woman aunt one receiv payment,0,0,0
watch porn quotveteran video roomquot pm till pm,0,0,1
indec exposur comment,1,0,0
drive twowheel uncl pass scooter nearbi comment give blow job,1,0,0
man look veri bad give bad express,0,1,0
seen girl stare upon guy make feel uncomfort also whistl ogl,1,1,0
get back home school man approach ice cream told take took start touch wrong threw ice cream ran away,0,0,1
go baluwatar balkumari nepal yatayatth bus pack saw ladi enter bus anamnagarth man around age tocuh ladi ladi felt uncomfort time everybodi start look man felt bad got bus,0,0,1
rickshaw back tri touch,0,0,1
eve teas comment,1,0,0
boy wdho sit soweto play ludo alway make veri bad comment girl women pass embarras much especiaali someon respect,1,0,0
realli terribl,1,0,1
travel alon comment chase peopl,1,1,0
nerul station daughter climb fob pervert came stair expos target daughter,0,0,0
travel kashmer gate bridg touch call vulgar name made sure never ever travel like,0,0,0
bhilwara labour coloni dure visit apart hunt labour bulli group show us knife side road,0,0,0
take pictur pass lewd comment,1,0,0
happen near colleg vocat studiessexu invit guy pee public,0,0,0
travel imadol due work guy know touch breast,0,0,1
think area nearbi not safe night girl,1,0,0
girl aunt walk road two guy came bike snatch chain thus injur,0,0,0
incid satya niketan foot bridg person comment dress sens girl,1,0,0
mid summer season friday night friend come back night virgil someon stop refus stopsudden boy came bush circl around lateron rape heraround three guy,0,0,0
harass,0,1,1
harass,1,0,0
follow tail partial bald middleag man wear armi shirt might polic sepoy purpos jog behind stop veri sli part even confirm ed stop random,0,0,0
drunk rikshaw puller comment,1,1,0
shop shopkeep said maal got angri slap guyit happen th may even,1,0,0
man masturb banana plantat look tourist walk road,0,0,0
friend walk home group boy seat around corner start whistl uswhen pretend not heard start call us namesw felt realli bad,0,1,0
happen girl stand next group boy whistl comment,1,0,0
two guy take pictur whistl one femal friend,1,0,0
person bike sudden came behind push relat snatch chain mother neck,0,0,0
walk street way work pass mani peopl shock one man put hand crotch although know isnt best neighborhood walk everyday must notic wasnt pay ani attent went male cowork well happen fast crowd peopl noth could,0,0,1
walk home stage man know kept shout name tell smart boast kept tell look shout shout ignor,1,0,0
walk street man came ask one night stand word made numb clueless approach push hard ran kept run till reach public area,0,0,0
accompani friend go somewher man stop car ask direct give direct pull pant show peni,0,0,0
touch indec exposur,0,0,1
poor street light,0,0,0
travel metro saw man tri touch woman inappropri ignor befor could interven got next station,0,0,1
street light mani part,0,0,0
oogl also even,1,1,0
chain snatch thief,0,0,0
travel via mirco bus even amp man sit next start whistl make nonsens express,0,0,0
incid took place around morningbas incid happen commut metro toward karol baghinappropri touch fulli load metro,0,0,1
touch,1,1,1
boy follow kamla nagar till hostel whistl told go away made even abus ignor walk faster,1,0,0
person repet dong,0,0,1
yes sexual harass sever time life,0,1,1
go friend hous wear nice chain two peopl bike sudden came tri take away chain besid full effort tri save chain,0,0,0
walk roadsid man whistl look show tongu click continu walk,0,1,0
shopkeep use misbehav girl tell lie help fill lic form would invit home touch inappropri,0,0,1
catcal touching/grop even,0,0,1
dure afternoon middl age man constant stare leg stop even though ask eventu get next station,0,1,0
dure night guy continu follow,0,0,0
even man tri touch woman bus,0,0,1
report taken dadar street market exact locat bigg sale societi store interviewe feel safe place due rush,0,0,1
friend mine year old suffer molest elder confin hous neighbourhood whenev use come home alon school,0,0,1
harass marri man,0,0,0
brother friend slept hous night tri rape succeed becaus smart,0,0,0
auto driver tri harass one friend number eve teaser increas,1,0,0
abus onc happen mei abus friend school campus sat togeth discuss one two thing discuss said someth made becom veri angri live quick made feel bad,0,1,0
guy pass hideous comment girl dress pass nearbyit took place even metro ( cp ),1,0,0
friend cross road random guy signal sit bike call us thought need help came know onli fulfil pathet desir,0,0,0
pass street men start pass vulgar comment,1,1,0
onc follow one unknown person return homeit realli scari,1,0,0
peopl touch also comment,1,0,1
ogl touched/grop bus rout,0,1,1
dure holiday went back home see parentsthat day alon home one unlc paid visital sudden start harass shout help,0,0,0
kamalakshi came outsid colleg around pm head toward atm though atm near colleg work go khandagiri yet cross ghatikia petrol pump sudden kamal slow becam bit unbalanc got scooti road time bolero cross us person shoulder length hair sit window stretch hand air later kamal told ride saw mirror person took sperm pube tri wipe whi got road,0,0,1
happen metro dure even night,1,1,1
come back colleg group boy start comment make vulgar express,1,1,1
saw certain girl two boy touch breast,0,0,1
wait inderlok metro station exit gate group four boy pass cheap comment follow see policeman turn around ran away,1,1,0
breast bottom grab press ladi get buse also molest come realli close stand behind ladi touch differ place ladi tri get bus pm bus stand crowd buse also normal get crowd grab bodi part second press vanish crowd pleas help,0,0,1
cab happenedthi mad man pull trouser,0,0,0
guy use follow dure month februari use travel pitampura coach class,0,0,0
friend teas three man whistl us well made strang sound use tongu,1,0,0
guy comment stalk,1,1,0
one man stare dure even time way home sister,0,1,0
friend friend wear short skirt crow place one guy touch thigh,0,0,1
way schoool mate boy smock grab friend start touch breast told run not look back,0,0,1
day friend return friend home boy chase us ask name phone number,0,0,0
go home school lone even group grop boysn whistl n sing n ask name,0,0,0
travel rickshaw man tri grope breast,0,0,1
policeman misbehav state bank india took place th octob,0,1,0
comment,1,0,0
call girl come along identifi bike helmet age around ask help around becaus less pedestrian movement around pm rais voic left,0,0,0
catcal,0,0,0
age yearstyp harassmentfaci express school leh ( day time ) take pictur leh market ( day time ) catcal school leh ( day time ),0,1,0
even somebodi comment,1,1,0
travel train nagpur chennai men kept follow stalk regular interv,0,1,0
wait cab boy continu star,0,1,0
girl came school met man kidnap end rape,0,0,0
boy sit far away friend kept say someth girl haiderpur villag stand balconi,1,0,0
call name villag zanskar,0,0,0
happen even,1,0,0
friend teas man handl station bridg cross way back home night way back home colleg near mulund help ran away didnt speak day onli later spoke,0,0,1
go colleg one boy pass comment us,1,0,0
middl age mad start masturb stare sinc not first time happen yell loudh ran away men gather tell bambaiyya languag quotwoh hila raha thaquot understood happen,0,0,0
happen one friend tution teacher harras long time,1,0,1
pm time govern colleg get student take buse go back home time peopl ( correct teenag labor ) tri harass school/colleg girl either comment look whistl girl dure hour avoid take public buse instead carpool classmat walk major way back home govern taken serious action group girl complain incid nearbi polic station,1,0,0
decemb februari travel around india lone white femal two separ occas ( two differ hotel ) nagpur group men attempt break hotel room clear intent sexual assault mei terrifi spent long wake night furnitur move door ( bolt drawn ) stop get men persist came repeat night tri forc door open could not open door forc would call ask open door sometim said work hotel need come recept ( point ) fire tri save ( claim four previous attempt throughout night forc door open befor even knock ) could hear differ men outsid room tri get,0,0,0
two boy block way enter bus also teas bad,1,0,0
comment sexual invit,1,0,0
stalk creep becam loiter around hous follow around wherev went groceri errand one day touch inappropri public scare went time final told mom follow went slap got public thrash never saw,0,1,1
chain snatch rob jewelleri,0,0,1
harass train,1,0,0
friend came back home night guy outsid bar panvel comment whistl,1,0,0
friend walk road two guy bike slow next us grab friend breast sped not even get time react complain crowd space yet dare,1,1,1
teacher rape pupil,0,0,0
stalk,0,0,0
onc alon delhi wait driver come pick almost pm men around call brother home could not get driver phone talk person sent driver one man start walk toward scare death could sens fear brother tone pass driver came run say enough thank god day,0,0,0
happen nd std build lift grope,0,0,1
peopl found comment women lat night near raksham nilayam,1,0,0
incid took place th septemb around pm khayala near pacif mallwhen pass area saw boy whistl comment girl pass,1,0,0
saw two boy bike snatch chain ladi go walkit happen januari morn,0,0,0
click pictur without permiss,0,0,0
way school mate boy forc stop talk,0,0,0
threaten touch indec exposur dure night,0,0,1
tie four friend went see movi grand masti boy sit back make sexual voic distur also commentng att,1,0,0
wit chain robberi,1,0,0
peopl near old fort near old delhi metro station bad activ,1,0,1
landloard wife routin drink silli go nake call girl,0,0,0
place sector vashi navi mumbai pm got sector bus stop best bus start walk toward home footpath shadi without street light decid walk along road walk someon loud scream footpath quota idhar idhar dekhquot involuntarili turn direct see guy ( labour ) masturb smile schock wait around turn back walk away brisk spot light crowd kept follow sometim found head direct mani peopl turn around went wayi shaken reach home felt fear reflect feel punch good howev run away could think moment,0,0,0
come back home coach class sudden someon bike held hand increas acceler bike,0,0,1
friend guy comment us made indec gestur,1,0,0
