Description,Commenting,Ogling,Groping
man stare smile near hous tri cross path/com veri close pass way work,0,1,0
misbehaviour,1,0,0
forc kidnap rape gun point men move car near dps rk puramafternoon amp pm,0,0,0
sunday night end year parti three us return night club sudden heard guy make funni sound behind us call usthi continu result one us rape molest,0,1,0
friend swim men take pictur us got,0,0,0
boy comment cloth,1,1,0
comment whistl,1,1,0
afternoon constant stare caus discomfort,0,1,0
one day saw men take ohoto women pass,0,0,0
due poor light one boy start comment look,1,0,0
friend went guy friend parti night tri forc,0,0,1
catcal,0,0,0
way colleg go platform catch next train someon grope butt turn around rush mani quotinnocentquot express left placeoverfoot bridg kurla station,0,1,1
attend funer ceremoni night wa music men came nowher attack usthey stole speaker rape girl,0,0,0
man kept push metro,0,0,1
tain journey touch person sit front seat,0,0,1
afternoon pm,0,0,0
dure even around pm shop friend guy cross us whistl loud,0,0,0
onc mini bus man tri touch unusu activ,0,0,1
guy tution center keep follow place scare tell parent stop go class,0,0,0
dure even deni park place guy return sport complex window smash,0,0,0
catcal touching/grop even,0,0,1
group guy eat popcorn start throw also pass veri cheap comment,1,0,0
around oo pm even go back home tuitiontheir two boy smoke drink side roadi pass side immedi start comment start touch mebut came two boy help start scream,1,0,1
age yearstyp harassmentstaringoglingfaci express changspa ( leh ) ( day time ),0,1,0
men catcal whistl pass way home class,1,0,1
walk along jog track end point man step behind bush masturb grin wear blue jean white tshirt look,0,0,0
colleg one boy came start taunt use bad word,1,0,0
near coach center boy gang pass comment even go class center foota road near kali mata mandir,1,1,0
boy use harass friend everyday front complex morn around month,0,0,0
person know like th std tutor call place regard clear doubt goe tutor place take room tri touch wrong placesth guy succeed though live koperkhairn way thane,1,1,1
night usual face problem ignor,1,0,0
dure night walk dad wit ladi chain snatch,0,0,0
catcal men societi area,0,0,0
guy bus purpos stick privat part girl veri common buse mumbai,0,0,1
around month go along friend place even wherein boy look start sing song friend shout happen dure even,1,0,0
peopl stare rikshwawala came stood near peopl start make wierd comment wait friend rech metro station,1,1,0
way school train boy came ladi coach pull chain ladi,0,0,0
eve teas street earli morn,0,1,0
onc got follow comment watchman happen residenti area panvel,0,0,0
friend went xmas th decemb exit got drunkth guy went took advantak situat rape hous,0,0,0
incid took place bus stand eveningther guy kashmer gate bus stand drunk behav inappropri,0,0,0
simultan harass catcal follow chain snatch,1,1,0
comment buse,1,0,0
friend walk road meanwhil stranger guy touch thigh stomach veri bad,0,0,1
drunkard tri grope girl bridg,0,0,1
bus conductor tri touch breast give ticket crowd bus,0,0,1
guy comment whistl,1,0,0
friend mine grope man ride bicycl,0,0,1
even,0,0,0
idl young men like comment shool girl dress everyday pass alway say walk like qeen,1,0,0
sister touch man bus,0,0,1
whistl,0,0,0
pass toi market men follow go,0,0,0
harass,0,0,1
touch grope,0,0,1
teas someon bus,0,0,0
guy tri intent take advantag crowd bus touch girl good see peopl take notic someth,0,0,1
walk crow road teenag boy came near tri dash,0,0,1
harass dure school trip male friend,0,0,1
parent went funer left alon boy came hous start touch scream,0,0,1
continu comment stare travel metro even,1,1,0
girl walk makina stage came across group men sit next berber shopthey call great ignor start insult,1,0,0
teacher beat pupil buttock,0,0,0
comment catcal,1,0,0
teacher beat student,0,0,0
neigbour mine abandon children husbandth man final gone met anoth childless woman sign marriag certif court,0,0,0
man sit next elbow continu got fed left auto,0,0,1
male touch,1,0,1
grope train bandra dadar first class compart,0,0,1
went market,1,0,0
man fight wife come home drunk wife ran away rape daughter,0,0,0
work intern organis author concern would touch inappropri even told not would still stare pass obscen comment final gave tri avoid much possibl,1,1,1
boy end road start whistl walk past,0,0,0
saw ladi afraid two men run behind,0,0,0
go home boy often,0,1,0
friend walk street group boy whistl us uncomfort,0,0,0
friend stand one piec dress man notic start make vulgar express,0,1,0
rickshaw anoth ladyon person scooter follow us snatch gold chainluckili didnt went handit happen afternoon around march,0,0,0
random guy take pic friendeven pm,0,0,0
neighbour sent shop came back gave soda drink later gave shill promis anyth long becam fianc,0,0,0
friend stalk random guy kept call messag day complain polic,1,1,0
vulgar comment pass dure night,1,0,0
friend teas group boy,1,0,0
friend told one old man next bus stare quit long time girl opposit wear short touch bodi uncomfort way,0,1,1
touch,0,0,1
man trancul oversleep wife taken hous group arm men rape dump,0,0,0
touch thrice metro station man even walk way,0,0,1
travel car famili worker car repair shop ogl made facial express realli disgust,1,1,0
classmat like follow girl especi go home tell teacher doe noth,0,0,0
know someon not name goe women buy pretend buy rais hand push organon leav themand goe doe soweto biashara street,0,0,1
peopl scare due less street light,0,0,0
groupof boy comment togeth make feel insecur,1,0,0
travel afternoon hour guy make weird facial express,0,1,0
touch bodi travel travel,0,0,1
go hospit one old man look like mental unstabl touch boob,0,0,1
veri aw felt horribl helpless took place dure afternoon,0,1,0
happen dhaula kuan bus stop lane eveningi walk colleg bust stop bunch guy stand start pass commentsthey board bus sinc crowd tri touch,1,0,1
group idl boy sit usalama bridg connect lindi laini saba harass chase even sexual abus girl way school,0,0,0
catcal touch comment chain snatch afternoon,1,0,0
peopl start comment bad word friend,0,1,0
way work man told look hot day quotumeivaa leoquot,1,0,0
thursday afternoon class boy tri touch girl,0,0,1
peopl follow made vulgar comment,0,1,0
whilst travel general compart local train bound dombivli cst man stand behind pinch bottom look back pretend take cellphon happen accid definit not case,0,0,1
wit age drunkard woman seduc young boy boy money think whi woman seduc touch chick lip boy push walk away,0,0,0
went pick brother school even met brother teacher invit hous promis give lot money saw packet condom pocket took,0,0,0
age yearstyp harassmenttak pictur parti ( night ) catcal wa jat ( look like jat ) ( day time ),0,0,0
one male friend model went green room someon touch,0,0,1
comment indec facial express,1,1,0
drunken person veri harsh comment friend also comment bad word,1,1,0
markit mea ham jate han yhan par mhilao ke sath comment paa kart hae,1,0,0
khoda market friend go mani peopl stare comment us,1,1,0
fix group boy goregaon fast local train alway pass lewd comment women stand cross track ( platform ),1,1,0
walk road boy wistl comment,1,0,0
onc sister auto auto driver sudden stop auto came act like check auto actual touch us happen twice us auto driver,0,0,1
guy tri touch privat part friend,0,0,1
girl harass not support familyat school campus,1,1,1
sexual invit,0,0,0
harass,1,1,0
teacher beat pupil,0,0,0
night guy whistl comment step collect note anoth girl,0,0,0
bunch guy pass veri bad comment,1,0,0
lewd behaviour,1,1,0
go catch train middl age man tri feel end get piec mind,0,0,1
incid took place afternoon placea person proclaim priest took hand hypnot veil read hand weird thing,0,0,1
harass dtc bus,1,0,0
stay night kasaragod hotel otherwis ok staff one ask sexual favor,0,0,0
realli bad,1,1,0
gone clinic dental checkup dentist touch neck inappropri start breath heavili sexual excit,0,0,1
ladi wear short dress walk along kibera law court drive men seat along road start shout indec soo embarras,0,0,0
dure even bus fulli fill worst moment life touch incid happen,0,0,1
maid daughter invit car,0,0,0
hi vicin total mall old airport road rowdi pass comment ogl everi girl pass buy live mts hell everi day walk offic,1,1,0
realli terribl,1,0,1
catcal comment lot ogl stalk sexual invit khan market group men gather especi around park lot block path stare laugh make sexual explicit comment group men appear pm wait cab tri hide cafe also intimid area alley fill men especi pm,1,1,0
vashi railway station desert timeit not like central line station bustl peopl henc get littl unsaf travel,0,0,0
stare irrelev unbear unnecessari comment,1,1,0
light amp sound show boy stand behind amp continu push privat part,0,0,0
dure teacher strike student gather friend place watch movi turn ponograph movi report parent,0,0,1
mother rape unknown men way back market,0,0,0
usual avoid comment onc guy use follow everydayi complain teacher help,0,0,0
got feel sexual harras go school guy tri take photo,0,0,0
unnecessari comment given biker guy comment us cross walk road colleg boy take phone number recept give us bluff call bother us call night time,1,0,0
neighbor use vagu languag shout creat nuisanc foul amp bad bodi languag,0,0,0
touch n comment,0,0,1
touch grope market area got crowd,0,0,1
involuntarili forc touch person,0,0,1
north east india report,0,0,0
girl go home back school saw one old man follow,0,0,0
dure even walk lone street could avoid not hurri subject filthi comment weird facial express,1,1,0
friend play ground sudden boy outsid came societi start teas comment,1,0,0
shop saw shopkeep give sexual invit,0,0,0
peopl follow cab amp pass comment,1,0,0
walk along agakhan walk begger sit said small buttock realli felt uncomfort,1,0,0
husband doe not take care famili provid basic need sinc not work depend,0,0,0
incid took place metro dure afternoon guy stand next metro comment group girl stand nearbi forc friend ask,1,0,1
guy commentingit happen even,1,0,0
one boy local teas sing whistl,1,0,0
attempt rape,0,0,0
comment ogl upon dilshad garden kashmer gate metro station,1,1,0
see road lot boy comment girl,1,0,0
comment ogl,1,1,0
realli bad,1,0,0
come back colleg heard boy whisper amongst themselv laugh look girl pass,1,0,0
walk tuition guy bike touch sped,0,0,1
misbehav,1,1,1
wake road guy gave sexual invit urin,0,0,0
around year old travel state transport bus parent due rush bus parent seat differ seat away sit differ seat man earli came seat next start general convers ask class told mention someth mental instabl problem sometim ladi hold babi stand next offer ladi help hold babi ladi hand babi soon took babi one hand insert anoth hand tshirt sleev grope breast shock happen also veri scare even tell parent pretend noth happen rememb stori clear even almost year,0,0,1
guy call tri snatch chain ran away,0,0,0
boy said bad comment girl walk girl walk guy walk bike,1,0,0
maratha mandir,0,0,0
look froim top buttom comment teas wistl group,1,0,1
riksha puller gang start say obscen thing,0,0,0
metro station man tri touch,0,0,1
saw girl comment boy comment teas call name,1,0,0
go home offic bafal group boy alway pass bad comment,1,0,0
stand platform wait train notic guy stare next day stare went around week came ask name colleg name addressi ignor still ask follow got angri warn bother follow lodg complaint tht never follow,1,0,0
tutori class return home group girl teas give sign sexual invit,1,1,0
bus man kept brush girl,1,0,1
rape husbandi not mood sex moment request becaus afraid unwant pregnanc agravi extent broke fight,0,0,0
street light poor lit difficult walk street higher chanc get eveteas,0,0,0
group boy blow whistl comment colleg,1,0,0
bus one man touch back quit long time nervous not abl ani thing,0,0,1
certain group boy give rude comment give vulgar express happen dure afternoon,1,0,0
go colleg,0,0,0
two guy click photograph friend public vehiclelat rais voic peopl remov next station,1,0,0
grope market,0,0,1
stand bus stop stranger came comment dress sens went ahead stop start stare bad way went away littl tri hide,1,1,0
pinch return colleg bus c onli becaus two stop becaus told not exact word english could slap hand full bag back also c also pretti crowd even enough space anyth wish stop,0,0,0
come school morn tuition young man follow ask detail follow long way name felt uncomfort ignor ran away,0,0,0
elbow,0,0,1
man kept stare made weird facial express buy veget wednesday market,0,1,0
catcal young boy follow near marin drive,0,0,0
boy wistl comment bad word,0,0,0
walk makina head salon men sit outsid pub stare one wink,0,1,0
harass amiti campus,0,1,0
night b coz work guy near bus stop behav appropri ignor took bus,1,1,0
bus passeng tri misbehav touch intent,0,0,1
use travel mani time h bus dure peak hour morn stand among crowd touch grope behind mani time,0,0,1
walk along oympic road men comment bad certain ladi use abus languag ladi felt inferior,1,0,0
stalk group friend boy dure republ day,0,0,0
go toward moment mall boy start comment us,1,0,0
one day got messag unknown numberi replythen start send indesc pitur messagesi eventu block,0,0,0
misbehav,1,0,0
around pm boy stop car use cheap word catcal tri stop friend way,1,0,0
man tri assualt dark street,0,0,0
usus thing watch peopl gaze road anywher scrutinis sexual organ,0,0,1
nurs student came guy teas say walk alon,1,1,0
last seat man sit besid tri touch first thought mistaken touch happen repeat began feel uncomfort scold man felt asham got bus,0,0,1
boy classroom teas girl say vulgur word alway,1,1,0
dure walk colleg flat group boy car sudden stop start comment,1,0,0
go wed taxi cram push sit besid driver sinc sit right besid could not get much space shift gear start touch right breast naiv ignor later pinch felt realli bad gut speak outthi happen way bandra,0,0,1
veri poor light area unsaf night,0,0,0
morn stand bus stop guy start unappropri manner tri touch hand part,0,0,1
travel road alway wit continu comment,1,0,0
push crowd comment groupsit happen even,1,0,0
boy like stop young women women refus follow go,0,0,0
onc offer free cab inappropri non verbal contact tri stop,0,0,1
travel crow bus time men tri grind intim part bodi,0,0,1
wrong behav,1,0,0
call name like ldzawa lay ( hey moon ),0,0,0
got grope tourist,0,1,1
peopl stare time one never wear reveal cloth,1,1,0
group four ( male femal ) walk around carter road area middl age man walk grope ass linger befor take step ahead entir area empti grope could accid friend call start rush away hurri post caught demand apolog proof henc take ahead polic tri involv nearbi polic satisfi apolog,0,0,1
incid occur even harrass plan rape kill certain ladi cought befor act case report polic,0,0,0
comment,1,0,1
comment mani chain snatch incid happen,1,0,1
femal usual feel veri unsaf area night due poor street lightsoften electr,0,0,0
teacher beat pupil,0,0,0
girl hostel man use come day time use show privat part expos,0,0,0
wait bus peopl comment,1,0,0
peopl pass comment girl pass park,1,0,0
whenev go outsid hostel face kind harass everywher everi timeit happen everywher outsid colleg hostel,1,0,1
stalk,1,0,1
one friend lock public bus harass howev escap,1,0,0
guy whistl staringit happen even,1,1,0
tri forc sex,0,0,0
one person touch breast shoulder footpath,0,1,0
friend walk back class sudden man came us start whistl bang friend start scream peopl one came help notic man follow us home notic outsid hous day,0,0,0
man came near touch breast insid public bus,0,0,1
group boy non virtual harass girl walk lone small street,1,0,0
cant specifi exact locat incid case happen everyday capit,1,1,1
wait friend bus stop unknown citi elder man kept star hour,0,1,0
stand bus stop one guy came attach bodi back,1,0,1
afternoon man follow take photo without concent especi bub,0,0,0
train man grope peni slap said quotyou onli touch slap mequotbetween dadar andheri,0,0,1
boy teas peopl react start fight,1,0,0
one friend verbal abus boy,1,1,0
ride scooti travel around would feel earlier mayb ride scooti would not eve teas much clear wrong recent dure ganesha visarjan notic men stare take excus traffic tri get close friend not even normal day find rickshaw driver stare wear skirt rise even wear indian wear still stare onc lone road car drive behind kept honk even though road empti,1,1,1
salesman ogl tri grope dlf emporioeven pm,1,1,1
travel panchpakhadi area thane station tuition ride bicycl one man follow bicycl constant tri speak want know name want know whether ride rout everyday time ignor noth could want rush tuition,1,0,0
happen stadium three girl came infront harass meon told sex dress sexuallya gentleman refus,0,0,0
afternoon street walk small brother guy comment dress feel unsaf,1,0,0
one classmat tuition class took pictur without knowledg later look phone found pictur mine,0,0,0
salesman kept stare insid store also came store follow,0,1,0
sister go home work truck driver pass dirti comment drunk took uturn took longer rout back home,1,0,0
head home school saw group men sit insid kiosk girl whistl men pass whistl felt veri uncomfort,0,0,0
play tenni coach continu stare,0,1,0
man invit girl come help fetch water get paid girl went done man lock door coupl hour girl came money,0,0,0
dure even around pm friend lunch group guy comment quotkanji humar saath bh lunch karl quot ( lunch us ),1,0,0
explain,0,1,0
travel bus crowd guy touch inappropri almost tear,0,0,1
come sub center place guy near mehrauli follow happen thrice place inform parent ask quit job fortun given anoth sub center though inform manag incid later,0,0,0
two year ago went villag sister wed one relat touch wherev like time not awar sexual harass know say remain silent,0,0,1
veri bad experi,1,1,0
old person tri touch inappropri place happen bus near juinagar station,0,0,1
even time go shop friend peopl sit insid car comment us veri bad manner,1,0,0
follow school home man think know live area scare inform parent might stop go school,0,0,0
incid took place morningi stand metro ( yellow line ) guy comment stare,1,0,0
saw man stare woman make funni nois made uncomfort,0,0,1
stalk,0,0,0
north east girl,1,0,0
return school home subway two/ three guy follow take photo,0,0,0
guy made indec comment tri grop girl near bal bharti public school,1,0,1
travel bus saket morn man stand besid grope thigh behindit veri disturb,0,0,1
peopl keep stare pass comment night,1,1,0
met new boy friend went place first time start show pnograph movi close eye not comfort sinc first date want know hime bett time remov cloth show peni,0,0,0
know girl sister rape naughti boy shesneak hous night good time girlfriend,0,0,0
peopl use bad word pass bad comment girl,1,0,0
one mom colleagu ask want learn yoga show interest want learn went learn name teach touch,0,0,1
boy ill treat girl,1,0,0
way themarket met woman age mum ask boyfriend,1,0,0
stare stalk,0,1,0
travel colaba cumballa hill bus one man stand next unzip pant flash start fall sit made nois slap conductor forc throw,0,1,1
comment pictur taken even,1,0,0
comment visit market,1,0,0
went visit friend found brother told sit came remov belt want rape not succeed,0,0,0
someon stalk,0,0,0
one aumti wait someon gurudwara sudden two peopl came snatch chainit happen afternoon,0,0,0
return home group young boy werw whistl comment,0,0,0
catcal comment bad facial express,1,1,0
go zoosom one touch leg,0,0,0
boy group start teas whistl go school,0,0,0
group boy start follow us,0,1,0
respect elder relat everytim meet touch back portion massag hug care mei like,0,0,1
somepeopl dtc bus behav bad,0,1,1
group boy came bike took scaf teas veri afraid,1,0,0
onc year young girl year rape kumba old man year parent girl took matter polic sinc not perminet resid kosala know case end,0,1,0
touched/grop,0,0,1
touch group men board bus,0,0,1
friend get back home school dda park saw man follow us quick rush mingl crowd got away,0,0,0
happen girl know crowd bus,0,0,1
peopl car comment,1,1,0
hi siru ppl done good jobim actuali frm visaz state andhra pradeshfor job purpos got shift hyderabad alon stay hostelto meet sister onc got bus till madhapura guy sat opposit seatm frnd wer talk chit chat busth guy sudden start show ( sorri unabl describ u clear ) conductor back busm frnd unabl complaint conductor onew felt shyhow say infront allw got busthi incid taken place near pmhow countri chang bad wayi want share u ppl,0,0,0
harrass regard sexual,1,0,0
touch inappropri place poor street light,0,0,1
guy comment mt morn,1,0,0
ovlock mother sent shop buy sugar way saw old man hold school girl touch buttock screem peopl came rescu girl,0,0,1
incid occur return school men stare give awkward express incid realli scare,0,1,0
bunch guy made cheap remark year old girl market,1,0,0
one friend propos accept use forc accept muchh use come home ask meet unnecessari hour,0,0,0
say go school noth instead wast parent money,1,0,0
friend mine sexual harass explain everyth good friend went guy hous guy sexual mode forc girl bed refus guy got well beaten becaus vow never visit boy hous,0,0,0
husband came hous complain affair men ask kind men talk start beat,0,0,0
happen almost everywher delhi,1,1,1
citi increas number eve teas issu month,0,0,0
young ladi year rape year old man ask,0,0,0
cat call grope whisper vulgar stuff ear happen numer time mani time happen broad daylight school grope near station small timeit horribl place ever think share rickshaw system kandivali east station lokhandwala area not safe molest rickshaw various men time time,1,1,1
boy near hous pursu whenev pass street start sing dirti song say thing like aaja mere paa thing,1,0,0
boy alway follow girl upto home girl not realiz follow,0,0,0
bright day time two biker snatch chain even though artifici feel unsaf travel citi,0,0,0
go colleg morn felt someon follow turn back saw guy know intent guy certain made uncomfort,0,0,0
big fan famous nepali pop singer use talk phone long timeand one day invit meet restauranti went meet talk veri nice afterward start touch slight take hand penisi afraid could not anyth moment kiss infront peoplei felt veri asham becaus went meet himfrom day onward start hate couldnot share stori anyon,0,0,1
two guy metro station show genit,0,0,0
happen north campus road toward vishwavidalaya metro stationindec name call one time morn anoth time face indec touch even,1,0,1
blackmail boy,0,0,0
teas take pictur young girl bus two old age man,0,0,0
men say ladi alway readi fuck due dress said becaus certai ladi veri short dres could bare bend,1,0,0
friend go toilet complex even boy follow month,0,0,0
chain snatch,0,0,0
go buy milk even one big man sister came follow guy pat back say wer r u go annoy thing said answer back say person care abt got worri ran home veri fast,1,0,0
realli bad,0,1,0
govern school man enter toilet girl need safeti,0,0,1
friend harass sanjay camp nightit month,0,0,1
niec got messag school teacher fb dirti sexual vulgar,0,0,0
survey carri safec ( red dot foundat ) along safec audit street market mumbai,0,1,0
comment catcal whistl,1,1,0
walk near bank man tap buttock ask normal,0,0,1
boy use teas girl one day call stay,1,0,0
realli bad,1,0,0
sometim peopl touch abrupt pass comment,1,1,1
year old man attempt rap year old child caught punish law,0,0,0
pass boy start shout suggest,0,0,0
kind lone road return home alon guy came follow street light got dim came closer kept say quotyou seen movi sex want quoti got scare went neighbor hous wait outsid hous see actual hous,0,0,0
bus,0,0,1
friend return school three boy start follow us pass comment well tri take pictur,1,0,0
onc electr home sleep terrac boy multiplex behind hous comment,0,1,0
stare,1,1,0
friend way colleg taxiaft reach destin driver touch wrong manner start flirt ask mobil number,1,1,1
comment,1,0,0
way home micro bussom unidentifi boy use filli word point toward veri disappoint,1,0,0
incid took place rajiv chowk metro station morn around ami stand line wait metro come two young guy start whistl laughingthen train came got women coach,0,0,0
seen boy stalk whistl girl,1,0,0
girl travel public vehicl one unknown person touch said come deni go later start blackmail say go end rape last went,0,0,1
chain purs got snatch,0,0,0
push public vehicl eve teas,1,0,1
face differ type verbal non verbal sexual harass differ place like public transport templ,0,0,0
boy tri touch anoth girl privat part,0,0,1
parti dure fest guy start take undu advantag crowd start touch us,1,1,1
sixteen year old girl rape group four men dure one nubian celebr,0,0,0
tea tea stall men kept ogl pass comment among themselv,1,0,0
walk someon tri touch bad manner,0,0,1
ogl grope sexual invit,0,1,1
abus uncl park pretend tri remov someth neck kiss could not stop cri,0,0,1
comment one happen everyday colleg,1,1,0
return offic home saw one girl short dress guy street start star comment bodi part,1,0,0
saturday morn travel mom meet brother hostel caught local public bus saw young boy touch girl girl feel uncomfort not repeat touch girl seem bad mood coz incid much,0,0,1
one day sister walk chabel chock boy followd smart act like taalk phone n say loud polish boy ran faster frm,0,0,0
boy whistl friend way home friend insult told would report chief offic,1,0,0
peopl car physic assault ladi,0,0,0
way home met group boy carri girl tri scream help one came help girl rape,0,0,0
cloth wearr take shower saw brother use play footballso told dress wear said alreadi put way remov ita angri shout start fightingthat,0,0,0
go school met man forc girl smoke bhang would sex girl,0,0,0
