Description,Commenting,Ogling,Groping
onc girl alway follow group boy onc go school guy follow got scare even tri touch follow day share stori mother mother made complain polic station guy custodi gurl safe,0,0,1
dtc bus wit guy tri touch girl follow even step bus dure even,0,0,1
incid took place near vasudha apart eveninga boy forc pull girl make sit bike,0,0,1
old man grab wrist start ask sexual favor get back home happen balaji chowk crowd area afternoon,0,0,1
drunk man touch brest,0,0,1
happen anytim normal happen everywher walk road,1,1,0
group boy use teas girl take pictur,1,1,0
boy men donot ani decenc toward women need walk street face kind harass,1,1,0
night phone stolen,0,0,0
happen afternoon,1,1,1
near hardrock cafe man tri grope,0,0,1
stalk alon,0,0,0
stand bus stop two guy bus stop crowd look around chang posit stood femal stand bus stop see face recogn guy could cheap thing stand near ladi wait bus guy also came near toa like also chang posit like notic action saw give cheap facial express see chang direct face opposit direct also notic contin smile look talk onli tri judg board bus also board bus boy stand next told parent wont abl travel public transport sort thing happen,0,1,0
need not specif date becaus experi renew everi time go rathifil bus station near secunderabad railway station long area grope buses/bus stop indec stare attempt stand close rub bodi take buse busstop year stalk stare grope rub onli hope better light upkeep presenc policemen chang situat,1,1,1
wait outsid lilavati hospit around pm weekday man motorcycl slow front grope breast harsh drove away befor could anyth,0,0,1
man probabl slum snatch chain,0,0,1
friend rickshaw come home dinner foreign driver difficulti understand direct crowd men gather round presum help one reach rickshaw grab friend breast veri angri jump vehicl began yell curs assail quit scare reaction ran mani similar situat happen time india not go stand quiet anymor like asham,0,0,1
comment stalk,1,0,0
travel bhaktapur group boy touch veri uncomfort,1,0,1
go public toilet home harass month,0,1,0
mani time wit harass delhi rohini sector dure morn afternoon eveningit common topic discuss,1,1,0
man came near invit sex,0,0,0
walk street man sudden grab breast ran away nowher found,0,0,1
vehicl go school got stage tout decid chang us onto anoth vehicl tri stop becauss get late driver insult mequotyou bitch shut upquot,0,0,0
local touch inappropri time crowdfl shoutedno one seem bother,0,0,1
visit templ boy turn turn push ran away,0,0,1
touch biker,1,0,1
dure afternoon two men came bike snatch chain ran away,0,0,0
someon took pictur without permiss,0,0,0
got train move staircas felt touch rear man behind not onc twice,0,0,1
four guy open jeep made indec remarksit happen night,1,1,0
mother went shop mother busi look differ dress notic stranger stare follow went mother told everi thing told one staff member person thrown,0,1,0
someon whistl chang rout becaus,0,0,0
boy start comment loud train,1,0,0
market buse one guy nudg pass comment make feel veri uncomfort buse veri overpack andcrowd,1,1,1
one professor track record sexual assault immatur gestur sudden hug held made project student uncomfort also anoth incid scare anoth vacat student program student push behind,0,0,1
incid took place metroboy even age men stand women coach second coach stare girl girl alien seen girl first time,0,1,0
friend enter lift old man also present old man tri kiss friend happen anusudhan societi dwarka sector,0,0,1
dmrc dure even two guy pass bike whistl loud,1,0,0
girl stuck even car broken guy approach pretend help happen worst nightmar could imagin,0,0,1
go shop buy groceri item even time boy follow comment know feel scare move away,1,0,0
guy touch friend inappropri even,0,0,1
ride scooter ride side big bus came wrong side driver laugh take veri danger thought die momenti face type incid sever time ride scooter ride scooter not safe kathmandu,0,0,0
dure afternoon go home guy whistl,0,0,0
guy tri touch inappropri long distanc passeng train mumbai kerala,0,1,1
friend told us incid school way stop guy held wrist start ask kiss,0,0,1
man came close friend bus touch privat part,0,0,1
around pm colleg return back toward metri station came across drunk boy take pictur mine comment feel unsaf travel alon,1,0,0
pass coridor gatwekera man nowher stood befor touch breast sya good suck felt uncomfort embarass,0,0,1
misbehavior boy pass vulgar comment girl,1,0,0
man sing obscen song,1,0,0
rape seen midnight girl found nake,0,0,0
watch tv cousin hous friend came sudden cousin friend start touch got ran,0,0,1
even happen blue line metro,1,0,0
indec exposur,1,0,1
sexual invit take pictur,1,0,0
chain snatch,0,0,0
peopl tend take advantag crowd dtc buse behav indec,0,1,1
four girl walk street namast supermarket dure late even one man stand road girl came nearer man show peni girl ran away due fear,0,0,0
middl age man tri put hand near girl privat part take cover bag,0,0,1
ogl facial express,0,1,0
stand outsid colleg wait auto boy came start stalk us,1,0,0
teas base color cast,1,0,0
travel crwode vehicl one man pull unnecessarili,0,0,1
metro station guy came hit breast could not react,0,0,1
sister stalk way back home sunday market,0,0,0
chain snatch outsid metro station auto driver,0,0,0
rickshaw friendtwo boy bike came near rickshaw tri snatch phone hand,0,0,0
class boy senior use n say love lot dont like allblackmail show differ emot not lisent mehe broke head injour total harresh,0,0,0
ride crowd car mumbai local train hand grab bottom turn bodi hope distanc anonym assail crowd move far time grope front upset nice coupl let squeez seat next get away man would not stop grab,0,0,1
boy like spank girl abus pass way school dure day lunch time,0,0,1
go class group guy stare,0,1,0
night comment,1,0,0
sector market,0,1,0
two guy take advantag crowd snatch girl chain happen dure night,0,0,0
kamla nagar around pm group boy look like colleg student splash beer dress ran away fast could told friend not want report polic becaus studi next year,1,0,0
boy veri crazi pull cloth walk street,0,0,1
age yearstyp harassmentfaci express leh market ( day time ) catcal school street leh ( day timeeven ),0,1,0
saw guy comment girlfriend figur walk,1,0,0
afternoon full public view man stop flash wait sidewalk,0,0,0
person kept push behind public bus much space stand,0,0,1
three boy sing song pass,0,0,0
sing song whistl,0,0,0
stand outsid gym alon driver pick due unavoid circumst got late time continu chase group boy stare till time driver came,1,1,0
go school deep vihar boy approach took hand forc tri grope want come somehow push ran away happen earli morn not mani peopl around,0,0,1
walk back home bunch guy whistl follow time,0,0,0
girl pass group guy pass comment appear,1,0,0
one aunti rickshaw chain snatch guy bike tri chase car unabl,0,0,0
girl abus policemanit happen night,1,0,0
guy took pantsit happen morn,0,0,0
one day go back home two strang boy tri talk ask go home,1,0,0
happen eveninng,1,1,0
delhi rewari passang traincom,1,0,0
come back home coach class sudden someon bike held hand increas acceler bike,0,0,1
gone shop near hous buy stuff even boy start follow got scare shout one came help walk faster spot father call boy ran away happen vika nagar street,0,0,0
teacher beat student,0,0,0
use go tuition near tuition boy alway use pass comment colour cloth use happen even around month,1,1,0
misbehav,1,1,0
guy comment,1,0,0
group boy blow whistl comment outsid colleg,1,0,0
go walk everi morn lecher guy alway stalk stare ladi pass,0,1,0
misbehav,0,0,1
travel best bus man tri get close warn move away,0,0,1
went walk earli morn around north campus area auto rickshaw driver start masturb saw,1,0,0
momo chowmein type comment,1,0,0
place wine work done sonm peopl drinkingther mani peopl mental disbehav,0,0,0
pm friend go road side itemswhen return young man call ask know particular place ask foundmi friend said yeson way place hit friend back,0,1,0
peopl tri take pictur us also comment look,1,0,0
move around chandni chowk market friend mine wass pinch twice privat part decid leav market without purchas anyth feel extrem uncomfort incid,0,0,1
go colleg guy stare whistl comment follow,1,1,0
happen near power housetwo motorcyclist pass give weird chaep comment whistl happen night,1,0,1
panjim market someon touch pass sinc crowd place,0,0,1
catcal,0,0,0
travel chandigarh delhi one elder person sit next complet half journey place bag seat squeez space seat tri sit closer tri put hand waist shift end seat avoid harrass,0,1,1
safe till date seen lot case like boy teas comment rough word girl,1,0,0
harass home famili member,0,1,1
even gate peopl alway comment touch,1,0,1
man show privat part,0,0,0
take pictur without consent jammu,0,0,0
teacher beat pupil,0,0,0
grope disembark train dadar station general compart man held breast press lead shock got shout tri catch mingl crowd kept stare shout abus could run due crowd creep walk,0,0,1
forc kidnap rape gunpoint men move car near dps rk puram,0,0,0
presenc gang male stare femal pass comment case emerg mark escap women,0,1,0
pass alway make signal among themselv start call pretti not like,1,0,0
stand near ticket counter metro station wee guy continu stare make veri uncomfort,0,1,0
guy lust,0,0,1
sister friend stalk three guy continu follow almost minut,1,1,0
sat car group boy start make facial express tri talk,0,0,0
sister follow unknown person bike,0,0,0
went bus bus got crowd guy tri touch feel dure night,0,0,1
went khanpur shop even sister group boy start follow us start walk fast also chang rout mani time would stop chase kept follow us went insid shop stay long time women shop one ask us happen told also told boy still outsid shop one ladi went chase boy away month,0,0,0
cousin friend juic even lot rush guy suppos stare sinc crowd werent sure start walk back pg met anoth friend talk told us someon stare turn saw guy realiz stalk kept take differ rout lost went back,0,0,0
men darajani call girl pass tell want someth import tell girl also promiss girl money,0,0,0
catcal comment bad facial express,1,1,0
case veri common area though never face ani heard lot,1,0,1
yesterday way sankhu girl two boy wear colleg dress wait bus boy talk use mani rough word girl feel odd scold boy,0,1,0
two boy teas girl,1,0,0
walk school came acroo group men stand outsid vehicl said big butt,1,0,0
harass,0,1,1
rob dark street corner unknown men,0,0,1
know happen girl women face everyday men walk toward bump basic tri kinda physic touch say anyth blame place crowd never meant anyth obvious girl come know someth done purpos happen mistak hurri stop everi step slap man tri yes frequent happen everi step crash man walk toward,0,0,1
travel girl friend munnar bus halt somewher munnar min break roam take pictur sudden man expos dk start wave toward us embarrass move ahead month date locat approxim,0,0,0
touching/grop dtc bus near munirka,0,0,1
happen friend get back shop men approach start misbehav comment ask sexual favor happen rajhan vihar afternoon,0,1,1
boy comment figur,1,0,0
go mosqu men start call shout tell quotuko sawaquotmean cute,1,0,0
man touch inappropri bus,1,0,1
scooter red red light micro bus conductor touch upper bodi part pass spontan could not even react,0,0,1
stare unnecesarili comment wierd stuff,1,0,1
catcalls/whistl comment ogling/faci express,1,1,0
follow,0,0,0
poor light bandra station dark unsaf night,0,0,0
walk olymp road men idl outsid movi shop stare girl pass pass well pstare,0,1,0
two guy tri block path tri touch,0,0,1
sister go market two chain snatcher came bike snatch gold chain,0,0,0
harass midday,1,0,0
villag hard get electr whole night would electr villag forget street light villag remain total dark night unsaf girl,0,0,0
man follow till hous,1,0,0
ogl comment,1,1,0
matern uncl home one friend tri harass touch unnecessarili even click pictur,0,1,1
misbehav,1,0,1
boy sodomis father,0,0,0
woman rape rober go work veri earli,0,0,0
sexual harres ladi travel micro bus,0,0,1
way back church dure xmas eve girl saw one walk saidquotwil like sex quot repli nosh got angri friend attempt remov trouser forc sex themthank god brother came rescu,0,0,1
realli bad,1,1,0
man follow touch behind,0,0,1
catcal comment bad facial express,1,1,0
ogl metro buse follow stalk till home stalk phone,0,1,0
girl pull men,1,1,1
evenig time boy tri touch aiim bus stop,0,0,1
near park follow boy even around month,1,0,0
guy follow car colleg chanakyapuri,0,0,0
sat auto go malviya nagar man came nowher touch inappropri shock happen near auto stand dakshinpuri,0,0,1
age yearstyp harass staringogl choglamsar ( leh ) near choglamsar bridg th decemb ( even ),0,1,0
cheap comment stranger,1,0,0
come across fool vagabond almost everi place colleg life pass indec comment whistl indec manner show vulgar gestur embarrass person ( girl,1,0,0
walk janakpuri metro station aakash institu small littl children tri pick pocket,0,0,0
travel somebodi stare follow,0,1,0
come home offic goonda sit nearbi comment appear,1,0,0
sexual invit hoot comment,1,0,0
guy bike stop car took key enter car snatch bag fled,0,0,0
walk street last even biker zoom past yell quotwhat babyquoti obvious react point becaus happen fast speed,1,0,0
yearold man alleg tri abduct molest yearold girl safdarjung enclav return school wednesday afternoon,0,0,1
chain snatch theft,0,0,0
pass friend place man look homeless start stare follow distanc moment realiz follow took rickshaw quick,0,0,0
saw girl conner boy touch privat part trie stop slap told get,0,0,1
misbehav,1,0,0
friend gone market even guy approach told like want friend told go away made sexual comment girl told mother turn blame not wear right cloth go,0,0,0
boy keep misbehav colleg told complain continu scare report,1,0,0
month back maid gone usual dryclean dri cleaner inappropri ask join hous insist come upstair anger maid told behav complain,0,1,0
young guy show privat part stand next girl dure afternoon hour,0,0,0
comment amp take pictur,1,0,0
misbehav girl go buy cloth,1,1,0
gone buy alcohol local shop men pass obscen comment say characterless woman becaus drink,1,0,0
realli bad,1,1,0
follow stare cross road go nearbi market opp ananda apart,0,1,0
happen near school,1,0,1
follow lane communiti,0,0,0
go home colleg rickshaw guy car side road whistl pass comment,0,0,0
vaishali buy fish guy start whistl catcal,0,0,0
even group come practic phone ea lost way,0,0,0
guy shout hoot girl pass comment give uncomfort look,1,0,0
morn comment wrong word group girl,1,0,0
men comment cloth bodi,1,0,0
head toward home peopl follow scari,0,0,0
unwant comment ask seat guy,1,0,0
happen went kerala travel busand look windowi saw guy stare make absurd face,0,1,0
friend guy continu whistl comment wait bus,0,0,0
auto driver kept drive absurd place,0,0,0
onc gone shop around newroad area men came near one behav weird blink eye teas show bad facial express,0,1,0
men touch drunkard ladi aimllesli take advantag condit,0,0,1
girl not allow get car shout driver drove fast ran away forc remain car happen near mini seashor sector vashi,1,1,1
peopl comment dress stuff kamla nagar areait happen even,1,0,0
realli bad,1,0,0
one person touch hand bus travel dolakha district,0,0,1
go share auto station r citi mall ghatkopar mumbai boy sit near take undu advantag,0,0,1
chain snatch morn,0,0,0
man bar drink call pass ladi enter bar window reach near call ask himquotdo know quot said quotcom one bottlequot told quoti not type excusequot went,0,0,0
onc walk road nearbi shop mall man pass say bad word privat part,1,0,0
night sent mum buy stuffso met guy tri convinc intervent firend help like would victim,0,0,0
uttam nagar termin bad boy start comment girl pass area,1,0,0
older man stare veri spars popul bus stop busi nandidurg road around pm jan,0,1,0
friend wet rain boy comment us,1,1,0
bandra fair group friend boy girl guy pinch ass realli hard time turn behind lost among crowd still idea,1,1,1
ogl stalk,0,1,0
teacher beat student,0,0,0
travel bus pepsi cola ratna park boy say bad word amp gestur annoy,0,0,1
walk street boy bike comment,1,0,0
harass rohini,0,0,0
stalk,0,0,0
wrong behav,0,1,0
year old school girl shadrack kimalel found injur bleed behind lindi friend church lindi villag defil left scene,0,0,0
man walk minut hand insid pant tri show dick assamp ran life till saw shop call someon come pick,0,0,0
report taken dadar street market exact locat bigg salemaitreen shopinterviewee not feel safe due instanc stare touch time dure visit,0,0,0
one male grope back travel general compart friend,0,0,1
way home pass olymp stage man winkl avoid walk toward ask number claim beauti girl walk veri fast never saw,0,0,0
wait train man would not stop stare,0,1,0
follow call messag difer contact number,0,0,0
matatu two young girl olymp makina girl alight karanja stage tout convinc go town talk also touch,0,0,1
friend walk lane man call name teas,1,0,0
tri touch hair comment beauti,0,0,0
chain snatch,0,0,0
friend mine go walk near northern ridg area somebodi start follow felt uncomfort start run escap,0,0,0
follow written day horrif experi year backquotteri chut lene maza aa jaegaquot said mayb fault never known mean repli quotmar ja jakequot voic quiver everi sharp exchang word later quit time thought better respons could given quotpolic ke pass chalega mujh bhi maza aa jaegaquot quotquot well thought still not abl put word sudden given glimps would feel like rape victim probabl would clichd say sudden felt expos everyon around could see indiffer mani eye around knew not happen middl road broad daylight ( pleas note still speak like rape victim ) saw mother daughter probabl year old gap made feel insecur want shout mother grasp daughter hand hold close sudden understood whi mother protect knew still somewher around watch love get high reaction caus thought made lighten didnt want give satisfact look around cheerili well not realli normal enough men around sudden seem leer casual glanc felt like pervert gaze wish pickup alreadi stupid someth year old encount innumer time sudden began seem threaten judg know sex addict st hand experi lust addict doe peopl around sudden thought come gut mean stage addict ( im assum not blunder attract say kind thing young girl ) probabl doe compuls must start somewher dont know singl person would say loud someth like even relationship dure naughti role play night believ tougher propos girl mayb isnt mayb brought famili angri father told daughter heavi abus mother open told father pleasur tonight sibl would call swear word involv mother sister casual call prostitut told thing wive fit forp pleas note date n time approxim,1,0,0
two men stare woman,0,1,0
way colleg travel bus pune man make facial express toward tri hold handi confus walk away next stop mine,0,1,1
girl come school group boy teas say bad word n sentenc take ani action ignor,1,0,0
chain snatch,0,0,0
near templ communiti ( indira nagar ) stalk,0,0,0
ill treat bus,1,1,0
experienc whistl teas street around home area,1,0,0
day veri crowd guy kept touch tri move away kept chang place next,0,0,1
ogl grope,0,1,1
case like robberi theft,0,0,0
month ago lane bhatbhateni found guy whistl show bad facial express,0,0,0
way ghatkopar dn nagar metro station saw man ( assum must marri ) ogl women platform gave man stern look whenev saw pretend look somewher els noth,0,1,0
boy gang around start comment,1,0,0
man thin voic yell somewhat low voic bayot becam appar wasnt respond step onto sidewalk wait walk toward say thing tone voic bayot,1,0,0
person comment pass dirti comment dure even hour,1,0,0
way back home colleg saw one middl age guy comment follow one ladi much help not awar relationship guy look rough,1,0,0
auto wala stare make express veri inappropri,0,1,0
colleg student stalk comment girl ( fest ),0,0,0
touch grope surat got annoy ignor thereaft,0,0,1
walk shop man whistl call,0,0,0
happen peeragarhi bus stand around pmi wait bus group gulligon whislt everi possibl girlthey huge group behav indec,0,0,0
happen almost time,1,1,0
saw old man hold class six pupil pm,0,0,1
girl beaten men later took hous rape left dead,0,0,0
sartuday morn friend appoint catch guy sudden taxi enter rascal took bush bad rape fell unconscioussh taken hospit given energi next minut pass away,0,0,0
comment loud bus stop front everyon nobodi anyth stop asham react,1,0,0
outsid comment girl,1,0,0
one man came closer walk way start make differ facial express,0,0,0
harras afternoon,0,0,0
way colleg boy start whistl comment,1,0,0
realli bad,1,0,0
travel place rickshaw guy santro car follow stare,1,0,0
go market alon boy came bike took girl photo teas later ran away,1,0,0
girl around yrs wear short contin stared/com upon group guy ( around ) awkward tooit happen afternoon blue line metro,1,1,0
onc one uncl middl age pinch breast,0,0,1
wrong touch given teacher,0,0,1
sister friend stalk three guy continu follow almost min,1,1,0
reckless drive market area,0,0,0
indec comment dure afternoon,1,0,0
guy yell physic assault girl road pm go downstair interven stop told would report stop horrid peopl watch happen one stop one man yell home second floor would call polic kind apathi quit scari,1,0,1
girl go attend parti even time cross narrow road way guy stare teas use bad word afraid go home,1,0,0
come back colleg boy follow road,1,1,0
small girl age year rape old man year earli morn mother left hous,0,0,0
comment walk,1,0,0
guy said friend hey beauti pass,1,0,0
bus person sit next continu stare seat chang start click pictur,0,0,0
person constant rub elbow bodi sit besid auto,0,0,1
man physic abus touch breast insid bus,0,0,1
saw man snatch chain,0,0,0
inappropri touch,0,0,1
show privat part guy travel dure afternoon,0,0,0
men comment take pictur mall,1,0,0
group men made obscen gestur pass car man metro took pictur,1,0,0
misbeha,0,0,0
govt offici time feel unsaf due overcrowd area,1,1,1
insid class room peep throughbth window saw man live theschool compoung whink make suggest sign,0,1,0
come alon boy comment whistl,1,0,0
harass mis behav,1,0,0
bus conductor rub bodi mine go around ticket,0,0,0
pass men start talk stare,1,1,0
dadar bridg incid grope touch crowd miscreant tend take advantag,0,0,1
eve teas late even road desert,1,1,0
bus wear short day man put hand thigh took hand sometim thing repeat sever time chang seat,0,0,1
went one shop sarojni nagar boy make facial express scold bad,1,0,0
guy whistkl,0,0,0
chain snatch,0,0,0
pass railway line friend man pass us stare eye eye turn back still look till fear,0,1,0
saw group guy take pictur girl sit pavement nearbi,0,0,0
man deliber touch femal copasseng dtc bus bus overcrowd,0,0,1
train delhi rewaricom,1,0,0
happen afternoon,0,0,1
comment made travel afternoon hour,1,0,0
auto driver follow kept make indec remark sinc mani peopl not around not sure react quick went bylan follow,1,0,0
grop boy comment,1,0,0
man approach anoth direct said someth got veri clear ( headphon hear said felt malign ) ignor kept walk got stuck traffic light turn around still make lude gestur stalk,0,1,0
man deceiv young ladi want send shop girl went hous man close door,0,0,0
return market boy start follow gave vulgar comment,1,0,0
took pictur amp comment,1,0,0
sister return work kandivali station platform old man get stair make obscen gestur face confront quotold man age quot took slipper hit everyon look,0,1,0
hous pm man walk hous knife close doori home friend pregnant littl sisterthi boy sexual harass ush knife made us understand friend outsid,0,1,0
group boy stalk friend,0,0,0
return home guy came bike start comment react ask tell mom sister,0,1,0
guy use harrass back school incid made psycholog mental disturb,0,0,0
head stage board bus someon grab hand ask number tri remov hand held tight everyon stare us felt veri asham let go hand walk quick board bus feel veri embarass,0,0,1
touch grope,0,0,1
friend stalk guy amp got someon amp start messag inappropri,0,0,0
girl come school shopkeep call went shop man took girl,0,0,0
ogl facial express,0,1,0
walk street,1,0,0
touch whistl follow,0,0,1
car men follow car tri deceiv,0,0,0
cab follow throughout ask sexual favour,0,0,1
guy whistl girl wait delhi metro feeder bus servic janakpuri,0,0,0
enter matatuand man held shoulder remov hand click wink,0,1,0
swim teacher tri assault,0,0,1
go market boy came bike tri touch privat part,0,0,1
chain snatch happen one aunti near sharma apart dwarka sec,0,0,0
walk toward station peopl stand outsid metro station made lewd commen,0,0,0
lot harass take place near area girl harass peopl roam around knive,1,1,1
bus phone stolen,0,0,0
classmat told move even neighbour buttock,1,0,0
n colleg fren return home one guy came talk us told us interest stuff show us unknown person insist us went narrow subway overther show us pron site,0,0,0
walk man opposit side grab breast ran away could not anyth,0,0,1
make facial express amp stare continu awkward way also face physic harass,1,1,1
friend hit shoulder full forc guy motor bile miss balanc fell broke mobil,0,0,0
best friend molest local train,0,0,1
one day elder sister walk street guy follow us scare start walk brisk whistl also start walk brisk hurri went crowd hide slowli crowd stop safe,0,0,0
return home metro station two boy bike touch behind befor could anyth sped away,0,0,1
forc,0,0,0
chain snatch,0,0,0
touch ogl,0,1,1
one old man pass young girl tri touch girl,0,0,1
abus word,1,0,0
incid took place morn sector rohiniwhen walk colleg pg boy group comment us,1,0,0
daytim way kapan bus man age around next bus not crowd person intent bad sat side start touch,0,0,1
